{
  "version": "1.0.0",
  "sessionId": "session-1772385348561-xmis9t",
  "mode": "test-only",
  "lastUpdated": "2026-03-01T17:15:48.567Z",
  "tester": {
    "completedTasks": [
      {
        "taskId": "test-1",
        "status": "passed"
      }
    ]
  },
  "developer": {
    "completedFixes": []
  },
  "knowledge": {
    "techStack": [],
    "gotchas": [],
    "testNotes": []
  }
}