{
  "version": "1.0.0",
  "sessionId": "session-1772385265835-15179s",
  "mode": "test-only",
  "lastUpdated": "2026-03-01T17:14:25.835Z",
  "tester": {
    "completedTasks": [],
    "storageStatePath": "playwright/.auth/user.json"
  },
  "developer": {
    "completedFixes": []
  },
  "knowledge": {
    "techStack": [],
    "gotchas": [],
    "testNotes": []
  }
}